id,link,content,start_time,end_time,programme_id,programme_date
"IRjS-W0BCKkHyZ2vQZXb","http://rtve.es/v/3579424?t=00h33m38s","La monarca más longeva.",2018,2021,3579424,"2016-04-21T21:00:00+00:00"
"th3m-W0BCKkHyZ2v8BMI","http://rtve.es/v/3563841?t=00h57m45s","El ex ciclista y comentarista de tve es el padrino de una iniciativa que trata unir a las personas mayores con las artes escénicas.",3465,3468,3563841,"2016-04-11T15:00:00+00:00"
"oBra-W0BCKkHyZ2vASat","http://rtve.es/v/3551893?t=00h27m17s","Su deseo, envejecer juntos sin dejar de disfrutar de la vida.",1637,1642,3551893,"2016-04-03T21:00:00+00:00"
"1RfM-W0BCKkHyZ2v4Vqj","http://rtve.es/v/3549700?t=01h00m04s","En nuestro caso se ha multiplicado por siete, afirma Yulia, la joven farmacéutica nos cuenta que antes lo pedían sobre todo las personas mayores, porque el Meldonium alivia las dolencias cardíacas.",3604,3608,3549700,"2016-04-01T15:00:00+00:00"
"6hra-W0BCKkHyZ2vikyx","http://rtve.es/v/3503433?t=00h30m50s","La localidad extremeña de Bienvenida acaba de inaugurar una Casa Museo dedicada a una de las dinastías más longevas y nutridas de la tauromaquia española.",1850,1854,3503433,"2016-02-28T15:00:00+00:00"
"Xhvf-W0BCKkHyZ2v74H5","http://rtve.es/v/3490665?t=00h49m31s","Amadeus de Forman se convertía en 1984 en la película del año, ganó 8 Óscar y en ella asistíamos a las memorias de un envejecido Salieri.",2971,2980,3490665,"2016-02-17T21:00:00+00:00"
"Gh_x-W0BCKkHyZ2vzKKc","http://rtve.es/v/3477902?t=00h24m16s","Es una auténtica terapia para enfermos con trastornos mentales o personas mayores con demencias.",1456,1459,3477902,"2016-02-07T21:00:00+00:00"
"thfN-W0BCKkHyZ2vZ3d4","http://rtve.es/v/3472500?t=00h03m05s","Hoy se celebra el Día Mundial contra el Cáncer No se han efectuado retrasos ni cancelaciones. una enfermedad que, según la OMS, se incrementará en un 70 por ciento, en las dos próximas décadas debido al envejecimiento de la población.",185,186,3472500,"2016-02-04T15:00:00+00:00"
"qhfN-W0BCKkHyZ2vanjm","http://rtve.es/v/3472500?t=00h37m10s","Pero la OMS advierte: hay que hacer aún más ya que, según sus previsiones, en los próximos 20 años habrá un 70% más de enfermos debido al envejecimiento de la población.",2230,2232,3472500,"2016-02-04T15:00:00+00:00"
"Zh_w-W0BCKkHyZ2veE6q","http://rtve.es/v/3463858?t=00h42m28s","Según el ayuntamiento con esta actuación se quiere prevenir el peligro de caídas de árboles defectuosos y envejecidos.",2548,2551,3463858,"2016-01-29T21:00:00+00:00"
"shfN-W0BCKkHyZ2vLmhg","http://rtve.es/v/3455282?t=00h17m01s","Cuiden de los vecinos, de las personas mayores, de los discapacitados.",1021,1024,3455282,"2016-01-23T15:00:00+00:00"
"eR3o-W0BCKkHyZ2v34l3","http://rtve.es/v/3449559?t=00h41m52s","Mamá"" Bonita dedicatoria que precede a una de las dedicatorias más célebres de la historia de la literatura, esa que tiene como destinatarias todas las personas mayores que fueron primero niños, aunque no lo recuerden.",2512,2515,3449559,"2016-01-19T21:00:00+00:00"
"ohvf-W0BCKkHyZ2vlmQo","http://rtve.es/v/3445951?t=00h27m39s","Llevan un mes sacando personas mayores que nunca pensó que la vida le iba a deparar ese capitulo al final.",1659,1663,3445951,"2016-01-15T21:00:00+00:00"
"6R3p-W0BCKkHyZ2vq7z7","http://rtve.es/v/3436825?t=00h45m50s","Así comenzaba su emisión ""Cuéntame"" el 12 de septiembre de 2001 Hoy es la segunda serie de televisión más longeva del mundo y sin embargo, su estreno estuvo en el aire.",2750,2755,3436825,"2016-01-07T15:00:00+00:00"
"Ph3q-W0BCKkHyZ2vLuaP","http://rtve.es/v/3434016?t=00h31m12s","Un repunte que Tráfico achaca al envejecimiento del parque móvil y a la relajación en el uso de las medidas de protección.",1872,1877,3434016,"2016-01-04T21:00:00+00:00"
"aR_w-W0BCKkHyZ2v9Gmt","http://rtve.es/v/3433628?t=00h27m31s","Un dato que la DGT achaca al envejecimiento del parque móvil y a la relajación en las medidas de protección.",1651,1656,3433628,"2016-01-04T15:00:00+00:00"
"xRfP-W0BCKkHyZ2vd-6U","http://rtve.es/v/3432617?t=00h33m47s","Visitamos ahora la localidad toledana de Consuegra para conocer a su vecina más longeva.",2027,2031,3432617,"2016-01-03T21:00:00+00:00"
"zRfP-W0BCKkHyZ2vd-6r","http://rtve.es/v/3432617?t=00h34m31s","Dejar a un lado las preocupaciones puede ser la fuente de su longevidad o tal vez su devoción a Santa Rita, aunque hay quien lo achaca a la copita de vino dulce que se toma con las comidas.",2071,2073,3432617,"2016-01-03T21:00:00+00:00"
"Wx3n-W0BCKkHyZ2v50tZ","http://rtve.es/v/3424017?t=00h16m17s","En 2013, la restricción se suavizó, La medida del ""hijo único"" la aprobó el régimen comunista en 1979 y, según los expertos, ha evitado el nacimiento de 400 millones de personas y ha causado el envejecimiento de la población.",977,981,3424017,"2015-12-27T15:00:00+00:00"
"gB7t-W0BCKkHyZ2vTZLW","http://rtve.es/v/3422839?t=00h23m40s","-Es mejor que vengan a una residencia en vez de estar solos las personas mayores porque está uno más entretenido.",1420,1423,3422839,"2015-12-25T21:00:00+00:00"
"YB_z-W0BCKkHyZ2vDfSJ","http://rtve.es/v/3419037?t=00h07m49s","Unos 40 millones de euros, repartidos gracias a un viaje de personas mayores.",469,473,3419037,"2015-12-22T15:00:00+00:00"
"ZB_z-W0BCKkHyZ2vDfSV","http://rtve.es/v/3419037?t=00h08m27s","Unos 40 millones de euros, repartidos gracias a un viaje de personas mayores.",507,510,3419037,"2015-12-22T15:00:00+00:00"
"Sx_w-W0BCKkHyZ2vkles","http://rtve.es/v/3414819?t=00h29m08s","Se basa en dos procesos de fermentación y luego pasa al proceso de crianza donde debe estar entre 9 y 90 meses para envejecer.",1748,1751,3414819,"2015-12-19T15:00:00+00:00"
"7xrb-W0BCKkHyZ2vwpFg","http://rtve.es/v/3409907?t=00h25m35s","La mayoría de las victimas eran personas mayores de 65 años que vivían solas, y menores que perdieron la vida en incendios originados en sus viviendas.",1535,1539,3409907,"2015-12-16T15:00:00+00:00"
"7x_w-W0BCKkHyZ2vX0bS","http://rtve.es/v/3408707?t=00h16m57s","Asegura que dedicarse a la política, envejece.",1017,1020,3408707,"2015-12-15T21:00:00+00:00"
"8h_w-W0BCKkHyZ2vX0bi","http://rtve.es/v/3408707?t=00h17m11s","Dicen que genera envejecimiento celular y es un factor de riesgo para enfermedades graves.",1031,1034,3408707,"2015-12-15T21:00:00+00:00"
"sxnU-W0BCKkHyZ2vOwcc","http://rtve.es/v/3408464?t=00h17m14s","Un estrés que genera envejecimiento celular y es un factor de riesgo para enfermedades graves.",1034,1037,3408464,"2015-12-15T15:00:00+00:00"
"IRfM-W0BCKkHyZ2v4lup","http://rtve.es/v/3393611?t=00h08m32s","Una de las razones de pérdida de población obedece al envejecimiento.",512,517,3393611,"2015-12-04T15:00:00+00:00"
"ih7s-W0BCKkHyZ2v5X4c","http://rtve.es/v/3377598?t=00h44m02s","El escaso mantenimiento de los coches y un parque móvil cada vez más envejecido, están detrás de este incremento, que supone además un mayor de riesgo de accidentes.",2642,2645,3377598,"2015-11-24T21:00:00+00:00"
"kR7s-W0BCKkHyZ2v5X4v","http://rtve.es/v/3377598?t=00h44m55s","Hay ruedas que vienen a lo mejor con diez años de envejecidas, pero esta nueva de dibujo y eso es hasta más peligroso que esto.",2695,2699,3377598,"2015-11-24T21:00:00+00:00"
"bxzl-W0BCKkHyZ2vccYy","http://rtve.es/v/3377077?t=00h37m53s","El escaso mantenimiento de los coches y un parque móvil cada vez más envejecido, están detrás de este incremento, que supone además un mayor de riesgo de accidente.",2273,2276,3377077,"2015-11-24T15:00:00+00:00"
"ih_z-W0BCKkHyZ2vMP5P","http://rtve.es/v/3355863?t=00h37m59s","Un nivel en el que ya se empieza a recomendar tomar precauciones sobre todo a las personas más sensibles como niños o personas mayores y ponerse la mascarilla si se sale hacer deporte o simplemente ir en bicicleta.",2279,2282,3355863,"2015-11-10T21:00:00+00:00"
"GhnY-W0BCKkHyZ2vtOZ5","http://rtve.es/v/3353898?t=00h45m12s","Sus canciones han envejecido tan bien que han agotado las dos fechas anunciadas en Madrid en media hora y han tenido que cerrar otra.",2712,2714,3353898,"2015-11-09T15:00:00+00:00"
"XRnV-W0BCKkHyZ2vmkUi","http://rtve.es/v/3352402?t=00h23m40s","Una carrera sin límite de edad para participar en familia, con circuitos para todos, desde corredores con bebés hasta personas mayores.",1420,1424,3352402,"2015-11-08T15:00:00+00:00"
"0BnY-W0BCKkHyZ2vIMGu","http://rtve.es/v/3347380?t=00h01m57s","España, con 83,2 años, es el segundo país más longevo del mundo, después de Japón que tiene una esperanza de vida dos décimas superior.",117,121,3347380,"2015-11-04T15:00:00+00:00"
"qRnY-W0BCKkHyZ2vKcIM","http://rtve.es/v/3347380?t=00h34m40s","Somos el segundo país más longevo del mundo.",2080,2084,3347380,"2015-11-04T15:00:00+00:00"
"rh7t-W0BCKkHyZ2vt65B","http://rtve.es/v/3340233?t=00h03m28s","El objetivo es, según las autoridades, conseguir un mayor equilibrio y hacer frente al envejecimiento.",208,211,3340233,"2015-10-29T21:00:00+00:00"
"OB7t-W0BCKkHyZ2vuK_N","http://rtve.es/v/3340233?t=00h26m56s","El progresivo envejecimiento de la población ha llevado a Pekin a autorizar a partir de ahora hasta dos hijos por pareja.",1616,1621,3340233,"2015-10-29T21:00:00+00:00"
"dhzj-W0BCKkHyZ2vp1fh","http://rtve.es/v/3339961?t=00h23m55s","Una decisión histórica que busca corregir el envejecimiento de la población, y el mayor número de niños, que de niñas.",1435,1437,3339961,"2015-10-29T15:00:00+00:00"
"fBzj-W0BCKkHyZ2vp1fy","http://rtve.es/v/3339961?t=00h24m36s","El envejecimiento de una población que, según el último informe de Naciones Unidas, tendrá una media de edad de sesenta años o más en 2050.",1476,1478,3339961,"2015-10-29T15:00:00+00:00"
"bxvf-W0BCKkHyZ2vGkoT","http://rtve.es/v/3338565?t=00h30m01s","Entendemos que los períodos actuales son muy largos, sobre todo, en personas mayores.",1801,1804,3338565,"2015-10-28T21:00:00+00:00"
"dRvf-W0BCKkHyZ2vGkol","http://rtve.es/v/3338565?t=00h30m28s","En lo que llevamos de año, al menos 190 personas mayores de 65 anos han muerto en accidentes de tráfico.",1828,1831,3338565,"2015-10-28T21:00:00+00:00"
"QR3m-W0BCKkHyZ2vkwvr","http://rtve.es/v/3338241?t=00h38m13s","Entendemos que los periodos actuales son muy largos, sobre todo, en personas mayores,y que al menos se debería volver a la anterior normativa y prorrogarlo por un máximo de cada 2 años a partir de los 70.",2293,2297,3338241,"2015-10-28T15:00:00+00:00"
"3RjQ-W0BCKkHyZ2vJw_Z","http://rtve.es/v/3328095?t=00h32m01s","Hay colectivos con más riesgo, son personas mayores mujeres embarazadas, y en los colectivos más, enfermos crónicos y personal sanitario.",1921,1924,3328095,"2015-10-19T15:00:00+00:00"
"3RbH-W0BCKkHyZ2vbh6r","http://rtve.es/v/3318881?t=00h20m52s","Y cuenta la historia de Heidi, una chica que sufre progeria, una enfermedad rara que le provoca envejecimientoprematuro.",1252,1255,3318881,"2015-10-10T21:00:00+00:00"
"ixvh-W0BCKkHyZ2vXtR5","http://rtve.es/v/3313914?t=00h37m06s","Cáritas asegura que la pobreza en España se ha cronificado y que afecta sobre todo a mujeres solas con hijos y a personas mayores.",2226,2230,3313914,"2015-10-06T21:00:00+00:00"
"qB7s-W0BCKkHyZ2veV9y","http://rtve.es/v/3313468?t=00h35m48s","Siguen siendo el colectivo más vulnerable junto a las personas mayores, por eso Cáritas pide políticas de acceso a la salud para ellos, a la vivienda, salarios justos.",2148,2155,3313468,"2015-10-06T15:00:00+00:00"
"1BbK-W0BCKkHyZ2vv96T","http://rtve.es/v/3312161?t=00h46m45s","A esta gira por España traen algunos de los números, que en estos 50 años les han convertido en uno de los grupos humorísticos más queridos, y también posiblemente el más longevo, junto a los Rolling Stones.",2805,2809,3312161,"2015-10-05T15:00:00+00:00"
"0h7s-W0BCKkHyZ2vWVf1","http://rtve.es/v/3307777?t=00h42m20s","El Gobierno ha presentado el Marco de Actuación para las Personas Mayores, que se aprobará la próxima semana.",2540,2544,3307777,"2015-10-01T21:00:00+00:00"
"2x7s-W0BCKkHyZ2vWlcU","http://rtve.es/v/3307777?t=00h43m26s","Se calcula que en 2030 crecerán hasta el 30 %. España es el tercer país más envejecido de la Unión Europea, comparable a Francia, y solo por detrás de Italia y Grecia.",2606,2610,3307777,"2015-10-01T21:00:00+00:00"
"4B7s-W0BCKkHyZ2vWlct","http://rtve.es/v/3307777?t=00h43m57s","""Se refiere a que las personas mayores mantengan una actitud y una aptitud como cuando eran jóvenes.",2637,2642,3307777,"2015-10-01T21:00:00+00:00"
"tBjR-W0BCKkHyZ2v8XzJ","http://rtve.es/v/3307559?t=00h32m33s","Hoy se celebra Día Internacional de las Personas Mayores bajo el lema ""La sostenibilidad y la inclusión de las personas mayores en el entorno urbano"".",1953,1957,3307559,"2015-10-01T15:00:00+00:00"
"thjR-W0BCKkHyZ2v8XzQ","http://rtve.es/v/3307559?t=00h32m56s","El aumento de la longevidad en los países desarrollados está dando paso a un nuevo concepto, el de la Gerolescencia Mayores activos ""Yo creo que es una doble dirección de la sociedad hacia nosotros, pero nosotros también a no quedarnos en casa"".",1976,1980,3307559,"2015-10-01T15:00:00+00:00"
"vBjR-W0BCKkHyZ2v8Xzj","http://rtve.es/v/3307559?t=00h33m39s","""Se refiere a que las personas mayores mantengan una actitud y una aptitud como cuando eran jóvenes.",2019,2023,3307559,"2015-10-01T15:00:00+00:00"
"xhjR-W0BCKkHyZ2v8nwO","http://rtve.es/v/3307559?t=00h34m26s","El Gobierno ha presentado el Marco de Actuación para las Personas Mayores, que se aprobará la próxima semana.",2066,2069,3307559,"2015-10-01T15:00:00+00:00"
"2RbH-W0BCKkHyZ2vsSom","http://rtve.es/v/3303310?t=00h37m22s","Las personas mayores, las personas con problemas económicos, los inmigrantes A ellos hay que añadir los discapacitados uno de cada 4 dice sentirse solo con mucha frecuencia.",2242,2244,3303310,"2015-09-28T15:00:00+00:00"
"gB_w-W0BCKkHyZ2v72jm","http://rtve.es/v/3299862?t=00h55m41s","Pues nada ahora a hacer como El Arabi y a envejecer juntos viendo fútbol, claro.",3341,3344,3299862,"2015-09-25T15:00:00+00:00"
"QhbI-W0BCKkHyZ2vTlWv","http://rtve.es/v/3297318?t=00h35m32s","Encontramos que las personas mayores de 65 años, un 15, 20% de ellos presenta algún grado de discapacidad España es el cuarto país europeo con menos muertes por cardiopatías, cáncer o diabetes.",2132,2136,3297318,"2015-09-23T21:00:00+00:00"
"Zhvf-W0BCKkHyZ2vd15R","http://rtve.es/v/3293958?t=00h59m02s","Sí, porque solo el técnico italiano y los jugadores mas longevos tienen en su palmarés esos tres oros europeos.",3542,3546,3293958,"2015-09-21T15:00:00+00:00"
"-h3o-W0BCKkHyZ2vinPn","http://rtve.es/v/3282176?t=00h28m51s","Es ya el programa de libros más longevo de la televisión.",1731,1734,3282176,"2015-09-13T21:00:00+00:00"
"tRvh-W0BCKkHyZ2v6fwN","http://rtve.es/v/3277893?t=00h40m20s","Y esta noche, después del telediario, vuelve a Televisión Española una serie que además de su éxito, ya puede presumir de longevidad.",2420,2423,3277893,"2015-09-10T21:00:00+00:00"
"QCDz-W0BCKkHyZ2v5iu9","http://rtve.es/v/3276313?t=00h16m47s","Cuál de estas dos visiones se impondrá, la de los que tienen miedo, o la de los que creen que Alemania, un país que envejece y no tienen hijos necesita a los refugiados, es algo que nadie por el momento se atreve a asegurar.",1007,1010,3276313,"2015-09-09T21:00:00+00:00"
"liDz-W0BCKkHyZ2v5yvS","http://rtve.es/v/3276313?t=00h29m05s","Ha heredado la buena salud y longevidad de su familia.",1745,1749,3276313,"2015-09-09T21:00:00+00:00"
"8hnY-W0BCKkHyZ2vE7_d","http://rtve.es/v/3275963?t=00h02m29s","Isabel II cumple hoy 63 años y 216 días de reinado superando a su tatarabuela Victoria y convirtiéndose en la monarca más longeva de la historia de su país.",149,159,3275963,"2015-09-09T15:00:00+00:00"
"Vxra-W0BCKkHyZ2vX0AT","http://rtve.es/v/3260261?t=00h02m10s","Las mujeres siguen siendo más longevas que los hombre.",130,137,3260261,"2015-08-27T15:00:00+00:00"
"9B3q-W0BCKkHyZ2vjPXR","http://rtve.es/v/3250521?t=00h36m30s","Los técnicos recuerdan que el envejecimiento de los vehículos y el consumo de drogas y alcohol son causas determinantes en el número de accidentes.",2190,2193,3250521,"2015-08-17T21:00:00+00:00"
"cBbI-W0BCKkHyZ2vJUha","http://rtve.es/v/3250266?t=00h35m27s","""Tenemos un problema y debemos actuar con celeridad y sobre todo centrar las campañas enfocadas a los motoristas y a los accidentes de motocicleta"" Los técnicos apuntan al envejecimiento del parque automovilístico y al consumo de drogas y alcohol al volante como otras causas determinantes en el número de siniestros.",2127,2131,3250266,"2015-08-17T15:00:00+00:00"
"fhfN-W0BCKkHyZ2vyJQ3","http://rtve.es/v/3230578?t=00h34m42s","Insisten, además, en que hay que actualizar los GPS, al menos, una vez al año, porque las carreteras cambian, y muchos de los errores que se cometen, es porque los mapas y las señalizaciones están obsoletas Investigadores españoles han desarrollado un tratamiento que consigue ralentizar el envejecimiento.",2082,2085,3230578,"2015-07-28T21:00:00+00:00"
"gRfN-W0BCKkHyZ2vyJQ_","http://rtve.es/v/3230578?t=00h35m12s","Investigadores de la Universidad de Oviedo han descubierto cómo retrasar el envejecimiento en estos animales.",2112,2116,3230578,"2015-07-28T21:00:00+00:00"
"gxfN-W0BCKkHyZ2vyJRF","http://rtve.es/v/3230578?t=00h35m22s","-Mediante el uso de inhibidores de esta proteína, de dot 1-l hemos sido capaces de reducir en gran medida los síntomas asociados al envejecimiento.",2122,2126,3230578,"2015-07-28T21:00:00+00:00"
"hRfN-W0BCKkHyZ2vyJRK","http://rtve.es/v/3230578?t=00h35m39s","Este equipo ha sido el primero en aplicarlo para retrasar el envejecimiento celular, de momento en ratones.",2139,2142,3230578,"2015-07-28T21:00:00+00:00"
"aBzm-W0BCKkHyZ2vVfnE","http://rtve.es/v/3230146?t=00h36m06s","Ser joven para siempre es un mito pero retrasar el envejecimiento prematuro es una gran esperanza para los que sufren algunas enfermedades raras.",2166,2169,3230146,"2015-07-28T15:00:00+00:00"
"bBzm-W0BCKkHyZ2vVfnQ","http://rtve.es/v/3230146?t=00h36m30s","Lo que sí se acerca es la posibilidad de retrasar el envejecimiento.",2190,2194,3230146,"2015-07-28T15:00:00+00:00"
"bhzm-W0BCKkHyZ2vVfnX","http://rtve.es/v/3230146?t=00h36m45s","""Pensad formas de vivir para siempre"" ""Pues te conviertes en vampiro y ya está"" No buscan la inmortalidad, sino curar enfermedades raras que causan envejecimiento prematuro.",2205,2208,3230146,"2015-07-28T15:00:00+00:00"
"cBzm-W0BCKkHyZ2vVfnd","http://rtve.es/v/3230146?t=00h36m58s","""Esa proteína dot 1-l que se conocía que estaba implicada en el proceso de la inflamación tiene un papel importante y drástico en el proceso del envejecimiento"".",2218,2221,3230146,"2015-07-28T15:00:00+00:00"
"cxzm-W0BCKkHyZ2vVfnl","http://rtve.es/v/3230146?t=00h37m16s","""En realidad el compuesto es un compuesto sintético que ya se utilizaba lo que pasa es que se desconocía por completo su funcionalidad en este contexto, en el del envejecimiento"".",2236,2240,3230146,"2015-07-28T15:00:00+00:00"
"wh7t-W0BCKkHyZ2vj6MO","http://rtve.es/v/3207418?t=00h50m53s","Y un secreto para su longeva vida.",3053,3057,3207418,"2015-07-11T15:00:00+00:00"
"kR3p-W0BCKkHyZ2vlrdx","http://rtve.es/v/3201302?t=00h38m11s","En este centro de día para personas mayores de Cataluña, insisten en que los ancianos beban.",2291,2293,3201302,"2015-07-07T15:00:00+00:00"
"iBnZ-W0BCKkHyZ2vPvhf","http://rtve.es/v/3200181?t=00h39m56s","Así lo afirma la DGT en un informe que alerta de que las principales causas de los siniestros son el envejecimiento de los vehículos y el mal uso de los dispositivos de seguridad.",2396,2400,3200181,"2015-07-06T21:00:00+00:00"
"iBbI-W0BCKkHyZ2vxWZU","http://rtve.es/v/3198530?t=00h10m28s","Jubilados niños personas mayores, los griegos se toman su tiempo para marcar la casilla, y lo hacen siempre detrás de las casillas azules, no quieren decir lo que han votado.",628,638,3198530,"2015-07-05T15:00:00+00:00"
"yRzj-W0BCKkHyZ2vwF6S","http://rtve.es/v/3191570?t=00h34m18s","Además de ellos, hay otros grupos de riesgo, como las personas mayores.",2058,2061,3191570,"2015-06-29T21:00:00+00:00"
"tR_y-W0BCKkHyZ2v_e_x","http://rtve.es/v/3188119?t=00h36m58s","Esta iniciativa se cuenta ahora en un documental que se llama presente perfecto y se ha convertido en viral en internet y que cuenta la historia de este proyecto de crecer y envejecer juntos.",2218,2221,3188119,"2015-06-26T15:00:00+00:00"
"zh_y-W0BCKkHyZ2v_u83","http://rtve.es/v/3188119?t=00h39m08s","""Estos días hay que beber más, al menos dos litros de agua, y sobre todo las personas mayores"".",2348,2352,3188119,"2015-06-26T15:00:00+00:00"
"bxjS-W0BCKkHyZ2vjKfn","http://rtve.es/v/3178740?t=00h21m01s","Hemos estado con una mujer que lleva conviviendo pocos meses con la enfermedad y también con el paciente de ELA más longevo de España.",1261,1265,3178740,"2015-06-21T15:00:00+00:00"
"Zxvf-W0BCKkHyZ2vBET3","http://rtve.es/v/3177839?t=00h27m17s","La mayoría de los glaucomas son hereditarios, pero también se producen al envejecer.",1637,1640,3177839,"2015-06-20T15:00:00+00:00"
"eBzk-W0BCKkHyZ2vC2j7","http://rtve.es/v/3174158?t=00h35m56s","Y que acelera su envejecimiento.",2156,2160,3174158,"2015-06-17T21:00:00+00:00"
"VBbK-W0BCKkHyZ2v__K4","http://rtve.es/v/3165785?t=00h16m21s","Aunque también asegura que la reforma de 2013 contribuirá a que el gasto público asociado al envejecimiento de la población sea sostenible.",981,985,3165785,"2015-06-11T15:00:00+00:00"
"tB7u-W0BCKkHyZ2vleHH","http://rtve.es/v/3145759?t=00h35m24s","Cada vez más personas mayores utilizan las nuevas tecnologías. especialmente aquellos que llevan una vida social activa.",2124,2128,3145759,"2015-05-28T15:00:00+00:00"
"dR7u-W0BCKkHyZ2vmOIb","http://rtve.es/v/3145759?t=00h57m12s","Pues ahora mismo creo que son 14 años seguidos jugando cada verano, entonces, en algún momento pues hay que tomar decisión de descansar y mirar la longevidad del jugador.",3432,3436,3145759,"2015-05-28T15:00:00+00:00"
"HB_x-W0BCKkHyZ2vuZ4F","http://rtve.es/v/3142580?t=00h24m43s","La mayoría son trabajadores de la construcción, agricultores, personas mayores o sin hogar.",1483,1487,3142580,"2015-05-26T15:00:00+00:00"
"tx_x-W0BCKkHyZ2vu54g","http://rtve.es/v/3142580?t=00h42m53s","Para rejuvenecer la imagen la policía italiana ha usado los programas de envejecimiento pero al revés; paso a paso ha ido rejuveneciendo a la persona que envolvieron con el sudario quitándole la barba y ajustando su mentón.",2573,2576,3142580,"2015-05-26T15:00:00+00:00"
"IBbG-W0BCKkHyZ2v3gFj","http://rtve.es/v/3140880?t=00h21m55s","""Y el voto joven claramente se ha aglutinado preferentemente, en torno a los partidos emergentes, Podemos y Ciudadanos, mientras que el PSOE y sobre todo el PP ha logrado retener más a las personas mayores, que son las que en medida relativa las que menos han podido padecer la crisis.",1315,1317,3140880,"2015-05-25T15:00:00+00:00"
"YxjT-W0BCKkHyZ2vNcsE","http://rtve.es/v/3132582?t=00h32m43s","-Les ayuda a saber qué es lo que sienten, a verbalizarlo y a saber que pueden hablar de ello con las personas mayores En este colegio dan una clase a la semana para reforzar su inteligencia emocional.",1963,1967,3132582,"2015-05-18T21:00:00+00:00"
"aRjT-W0BCKkHyZ2vNcso","http://rtve.es/v/3132582?t=00h33m29s","El estudio se ha hecho a 450 personas mayores sanas de 67 años.",2009,2015,3132582,"2015-05-18T21:00:00+00:00"
"OxbJ-W0BCKkHyZ2vho_6","http://rtve.es/v/3112849?t=00h33m47s","Un grupo de científicos americanos y chinos, liderados por el español Juan Carlos Izpisúa, aseguran haber dado con una clave genética contra el paso de losaños En un estudio que publica la revista Science, demuestra que las mutaciones genéticas del síndrome de Werner, un trastorno que conduce al envejecimiento, suponen el deterioro de unos determinados paquetes de ADN.",2027,2031,3112849,"2015-05-01T21:00:00+00:00"
"PRbJ-W0BCKkHyZ2vzqD6","http://rtve.es/v/3098784?t=00h07m52s","La licencia para tener una como esta es la misma que se exige para una escopeta, y sólo la pueden tener personas mayores de 18 años.",472,475,3098784,"2015-04-20T15:00:00+00:00"
"tBbL-W0BCKkHyZ2vGPpf","http://rtve.es/v/3095056?t=00h39m18s","Hogares unipersonales, que en el 40%de los casos son personas mayores de 65 años más lugares pequeños.",2358,2360,3095056,"2015-04-17T15:00:00+00:00"
"Bx_y-W0BCKkHyZ2v0uJd","http://rtve.es/v/3090240?t=00h11m09s","En contra, según el Fondo, las reminiscencias de la crisis que aún atenazan las economías, el envejecimiento de la población y una productividad más baja.",669,672,3090240,"2015-04-14T15:00:00+00:00"
"LR_x-W0BCKkHyZ2vW4id","http://rtve.es/v/3079159?t=00h20m52s","Explica que el envejecimiento de la población y una menor productividad ha rebajado las expectativas de crecimiento, tanto en países avanzados como en emergentes.",1252,1256,3079159,"2015-04-07T21:00:00+00:00"
"yB_x-W0BCKkHyZ2vXYhr","http://rtve.es/v/3079159?t=00h39m40s","La población española es cada vez más longeva.",2380,2385,3079159,"2015-04-07T21:00:00+00:00"
"zh_x-W0BCKkHyZ2vXYh8","http://rtve.es/v/3079159?t=00h40m09s","Es el hombre más longevo de España.",2409,2413,3079159,"2015-04-07T21:00:00+00:00"
"0x_x-W0BCKkHyZ2vXYiK","http://rtve.es/v/3079159?t=00h40m29s","El envejecimiento de la población es evidente.",2429,2432,3079159,"2015-04-07T21:00:00+00:00"
"2h_x-W0BCKkHyZ2vXYim","http://rtve.es/v/3079159?t=00h41m06s","Este ratón sufre envejecimiento prematuro.",2466,2469,3079159,"2015-04-07T21:00:00+00:00"
"4B_x-W0BCKkHyZ2vXYi6","http://rtve.es/v/3079159?t=00h41m28s","Al envejecer se fracturan y el organismo no logra reponerlos en su totalidad.",2488,2491,3079159,"2015-04-07T21:00:00+00:00"
"4R_x-W0BCKkHyZ2vXYjF","http://rtve.es/v/3079159?t=00h41m33s","Los investigadores han activado una proteína que renueva los nucleótidos y retrasa así el envejecimiento.",2493,2496,3079159,"2015-04-07T21:00:00+00:00"
