id,link,content,start_time,end_time,programme_id,programme_date
"7LNxmXABegwEKATwYwvE","https://www.rtve.es/v/5527179/?t=00h44m46s","Su longevidad en la élite, en su posición, también significa liderar otras estadísticas como el número de expulsiones, 5 en un clásico.",2686,2691,5527179,"2020-03-01T15:00:00+00:00"
"pbMlj3ABegwEKATwBQOu","https://www.rtve.es/v/5526555/?t=00h20m38s","La mayoría son personas mayores, las más vulnerables, por las patologías que ya padecen y que, al empeorar con el virus, comprometen su supervivencia.",1238,1242,5526555,"2020-02-28T21:00:00+00:00"
"q7Mlj3ABegwEKATwBQPU","https://www.rtve.es/v/5526555/?t=00h21m26s","Italia es uno de los paises mas envejecidos del mundo.",1286,1290,5526555,"2020-02-28T21:00:00+00:00"
"HOWLenABTetNpVUiU_nQ","https://www.rtve.es/v/5522098/?t=00h29m42s","Los que más la padecen son personas mayores de 60 años con insuficiencia cardíaca, ocho de cada 10 ingresados falleció durante los episodios de calima.",1782,1783,5522098,"2020-02-24T15:00:00+00:00"
"8-U-cHABTetNpVUiL_GK","https://www.rtve.es/v/5520737/?t=00h03m13s","Viven en Beariz, en Ourense, un pueblo y una provincia que figuran entre los más longevos de Europa, en el Telediario les contamos el secreto.",193,197,5520737,"2020-02-22T15:00:00+00:00"
"rOU-cHABTetNpVUiMfLY","https://www.rtve.es/v/5520737/?t=00h30m13s","Si bien, el gobierno de Cantabria ha redactado ya un Real Decreto mucho más restrictivo, que incide, sobre todo, en el control de derecho de admisión de estas salas, pero que será ya para lo sucesivo. salas Ourense es la provincia más envejecida de España y la tercera zona de Europa.",1813,1817,5520737,"2020-02-22T15:00:00+00:00"
"reU-cHABTetNpVUiMfLa","https://www.rtve.es/v/5520737/?t=00h30m29s","Según los expertos, en 20 años, se convertirá en la más longeva del mundo.",1829,1832,5520737,"2020-02-22T15:00:00+00:00"
"teU-cHABTetNpVUiMfLy","https://www.rtve.es/v/5520737/?t=00h31m11s","Beariz es un ayuntamiento de menos de mil habitantes de Ourense, la provincia más envejecida de España y la tercera de Europa.",1871,1875,5520737,"2020-02-22T15:00:00+00:00"
"tuU-cHABTetNpVUiMfL1","https://www.rtve.es/v/5520737/?t=00h31m17s","Según los indicadores de proyección demográfica este territorio dentro de 20 años será el más longevo del mundo Los ancianos de las zonas rurales de Ourense viven muchos años con calidad de vida por la falta de estrés, la alimentación y la actividad física que realizan.",1877,1881,5520737,"2020-02-22T15:00:00+00:00"
"FeUZa3ABTetNpVUiofCb","https://www.rtve.es/v/5520201/?t=00h33m11s","-Se va envejeciendo y empobreciendo.",1991,1994,5520201,"2020-02-21T21:00:00+00:00"
"NOUZa3ABTetNpVUiovAM","https://www.rtve.es/v/5520201/?t=00h35m33s","En su conjunto, la provincia de León está cada vez más envejecida y vaciada Si nos fijamos en los habitantes de la provincia, vemos que en los últimos años la población ha bajado en casi 40 mil personas.",2133,2137,5520201,"2020-02-21T21:00:00+00:00"
"TeUZa3ABTetNpVUiovBk","https://www.rtve.es/v/5520201/?t=00h38m08s","La falta de oportunidades expulsa a los jóvenes y la poblacion envejece.",2288,2293,5520201,"2020-02-21T21:00:00+00:00"
"FsgXX3ABTetNpVUiJoge","https://www.rtve.es/v/5516046/?t=00h28m58s","Y es que el COVID 19 sigue siendo un virus muy contagioso, con más riesgo de muerte para las personas mayores, pero con una tasa de mortalidad más baja que otros coronavirus, según un estudio publicado por China y recogido por la Organización Mundial de la Salud.",1738,1741,5516046,"2020-02-18T15:00:00+00:00"
"MjMqUnABaHdDzgWjwE4o","http://www.rtve.es/v/5513250/?t=00h26m19s","Las personas mayores, creían que firmaban un recibí por recibir cualquier material sanitario, por ejemplo, una muleta.",1579,1583,5513250,"2020-02-15T15:00:00+00:00"
"F2oOR3AB51Iw4nTHAiaG","http://www.rtve.es/v/5512527/?t=00h43m04s","- Sonaba desde ejemplo, San el secreto para una longeva historia. tratar de comprenderse al otro, o decirse muchas veces te quiero.",2584,2588,5512527,"2020-02-14T15:00:00+00:00"
"42q_PHAB51Iw4nTH2xvy","http://www.rtve.es/v/5509303/?t=00h01m13s","Supone el ahorro de personas mayores.",73,77,5509303,"2020-02-11T21:00:00+00:00"
"G2q_PHAB51Iw4nTH3hxv","http://www.rtve.es/v/5509303/?t=00h09m49s","""Supone ahorros para el coste de las personas mayores, de los más frágiles, de los más vulnerables.",589,592,5509303,"2020-02-11T21:00:00+00:00"
"sWolOHAB51Iw4nTH-BjM","http://www.rtve.es/v/5508918/?t=00h14m58s","Detrás hay una filosofía de la izquierda para evitar un coste social que tiene el envejecimiento en nuestro país por la vía del recorte de prestaciones, del recorte de derechos sociales, del recorte de ayudas ciudadanos, que, en principio sí apoyará en proposición de ley, ha presentado otra de cuidados paliativos que dicen, es complementaria.",898,903,5508918,"2020-02-11T15:00:00+00:00"
"_nBxNXABMoo45oY7cTsP","http://www.rtve.es/v/5505830/?t=00h35m05s","Con la ley del 2.005 lo que se busco fue que garantizar el derecho de todas las personas mayores de 18 años que nacieron fruto de la donación de semen o de óvulos a conocer quienes son sus padres biológicos, pero sin embargo esto no les permite solicitar ningún tipo de compensación económica.",2105,2108,5505830,"2020-02-07T21:00:00+00:00"
"MHBxNXABMoo45oY76k_w","http://www.rtve.es/v/5504240/?t=00h43m34s","Es lo que tiene irse longevo, que las nuevas generaciones.",2614,2619,5504240,"2020-02-06T15:00:00+00:00"
"bXBxNXABMoo45oY7j0SP","http://www.rtve.es/v/5499265/?t=00h27m17s","Jesús Gil lidera la lucha contra el envejecimiento celular en el principal centro de investigación biomédica de Londres.",1637,1641,5499265,"2020-02-01T15:00:00+00:00"
"pHATNXABMoo45oY75C-8","http://www.rtve.es/v/5498583/?t=00h38m39s","Sanidad insiste, 40 y 2% de los casos se detectan en personas mayores.",2319,2321,5498583,"2020-01-31T15:00:00+00:00"
"3XATNXABMoo45oY7wSb_","http://www.rtve.es/v/5496263/?t=00h42m00s","-¿Cómo quieres vivir y envejecer?",2520,2525,5496263,"2020-01-29T15:00:00+00:00"
"UwzXtm8BCxDtSJLwii-M","http://www.rtve.es/v/5486409/?t=00h04m39s","Y con 57 años, que tiene aún más mérito y le convierte por segunda vez, al igual que hace dos años en el piloto más longevo en conseguirlo.",279,283,5486409,"2020-01-17T15:00:00+00:00"
"CwzXtm8BCxDtSJLwjTA6","http://www.rtve.es/v/5486409/?t=00h32m20s","El envejecimiento es un factor de riesgo para que perdamos cromosoma y también lo es fumar Además, la contaminación puede agravarlo.",1940,1943,5486409,"2020-01-17T15:00:00+00:00"
"ngzXtm8BCxDtSJLwjzAe","http://www.rtve.es/v/5486409/?t=00h49m45s","Ya entonces Carlos Sainz se convirtió con 55 años en el piloto más longevo en imponerse en el rally más duro del mundo.",2985,2988,5486409,"2020-01-17T15:00:00+00:00"
"7SqMrG8BwjfvbX7BYvXh","http://www.rtve.es/v/5483916/?t=00h39m21s","La mayoría personas mayores como Amada, de 92 años.",2361,2365,5483916,"2020-01-14T21:00:00+00:00"
"8CqMrG8BwjfvbX7BYvX4","http://www.rtve.es/v/5483916/?t=00h39m29s","""Aquí lo que tenemos es una población envejecida, pluripatológica, polimedicada y que requiere supervisión estrecha.""",2369,2373,5483916,"2020-01-14T21:00:00+00:00"
"3hh8iG8Baf3yBvVW9iL3","http://www.rtve.es/v/5479634/?t=00h16m05s","Y lo que es más grave: Sin reformas no vamos a adaptar nuestra economía a los tres grandes retos que tenemos por delante: envejecimiento, la revolución digital y la lucha contra el cambio climático.",965,967,5479634,"2020-01-08T21:00:00+00:00"
"_xhYg28Baf3yBvVW1SGL","http://www.rtve.es/v/5478623/?t=00h46m03s","La atención a las personas mayores y el cuidado de la salud en casa, dice este consultor tecnológico, son un mercado en auge.",2763,2766,5478623,"2020-01-07T15:00:00+00:00"
"hxgKeW8Baf3yBvVWiRfJ","http://www.rtve.es/v/5477716/?t=00h04m11s","Dos personas mayores han muerto y otra se encuentra muy grave tras el incendio producido a las seis de la mañana en una vivienda de Hellín, en Albacete.",251,255,5477716,"2020-01-05T15:00:00+00:00"
"ahiWaW8Baf3yBvVWlhEL","http://www.rtve.es/v/5476433/?t=00h26m52s","Entre ellos, cinco orangutanes y tres gorilas, incluido el más longevo de Europa, que tenía 48 años.",1612,1615,5476433,"2020-01-02T21:00:00+00:00"
"ARhwZG8Baf3yBvVWOgxB","http://www.rtve.es/v/5475808/?t=00h15m44s","Madrid es una de las ciudades con mayor longevidad del mundo, con uno de los mejores de transporte del mismo y cada vez se está utilizando más renovación de caldera y de vehículos.",944,948,5475808,"2020-01-01T21:00:00+00:00"
"qhhwZG8Baf3yBvVWPAxF","http://www.rtve.es/v/5475808/?t=00h34m39s","Y que la tele nunca envejece.",2079,2082,5475808,"2020-01-01T21:00:00+00:00"
"XBhIX28Baf3yBvVW5Arp","http://www.rtve.es/v/5475448/?t=00h29m22s","También aconsejan precaución a las personas mayores.",1762,1765,5475448,"2019-12-31T15:00:00+00:00"
"3RgjWm8Baf3yBvVW3Qg5","http://www.rtve.es/v/5475074/?t=00h33m45s","Entre ellos, muchos niños y personas mayores que las pasan en el hospital y que hoy han recibido una sorpresa.",2025,2029,5475074,"2019-12-30T21:00:00+00:00"
"4hQXNm8B9QO-ETTBsl0f","http://www.rtve.es/v/5471888/?t=00h31m31s","En Corella, en Navarra, estas navidades triunfa la yayacleta, una forma de que las personas mayores con movilidad reducida vuelvan a pasear por su pueblo.",1891,1894,5471888,"2019-12-23T15:00:00+00:00"
"nxTwMG8B9QO-ETTBTVkk","http://www.rtve.es/v/5471434/?t=00h15m03s","Los 13 millones de euros que han caído en esta localidad de casi 7 mil vecinos han tocado sobre todo a personas mayores que participan en un proyecto para prevenir la dependencia.",903,906,5471434,"2019-12-22T21:00:00+00:00"
"AxTJK28B9QO-ETTB5lbc","http://www.rtve.es/v/5470984/?t=00h35m45s","Son datos de la asociación ""Amigos de los Mayores"", que, para ayudar a combatir este aislamiento, organiza comidas de Navidad en todo el país para casi 2000 personas mayores.",2145,2149,5470984,"2019-12-21T15:00:00+00:00"
"BhTJK28B9QO-ETTB5lbm","http://www.rtve.es/v/5470984/?t=00h36m35s","Han celebrado esta comida solidaria en Barcelona, y han hecho ya 21 comidas, y han invitado a 2000 personas mayores.",2195,2199,5470984,"2019-12-21T15:00:00+00:00"
"EBR9IW8B9QO-ETTBO1Fs","http://www.rtve.es/v/5469562/?t=00h49m41s","Chuwaka y los robots son los únicos que no envejecen y ojo a estebeso, el de Leia y Han.",2981,2985,5469562,"2019-12-19T15:00:00+00:00"
"ohTRHG8B9QO-ETTBTEm3","http://www.rtve.es/v/5467335/?t=00h32m09s","""Jóvenes, personas mayores, familias... y todos aquellos que se desplazan por carretera vengan al ferrocarril"" ""Si están a ese precio yo sí que lo cogería y me iría en AVE"" ""Más de una vez he cogido el autobús porque es más económico, entonces yo creo que sí que va a ayudar a que la gente se anime a coger el AVE"".",1929,1934,5467335,"2019-12-16T21:00:00+00:00"
"BGeKDm8BPmmmc_Kh5J0t","http://www.rtve.es/v/5466115/?t=00h39m31s","Para las personas mayores es fundamental mantenerse activos, relacionarse e incluso cumplir sueños de la infancia.",2371,2375,5466115,"2019-12-14T15:00:00+00:00"
"PGeKDm8BPmmmc_Kh2Jti","http://www.rtve.es/v/5463972/?t=00h36m13s","Lo que piden es que las personas más vulnerables, menos pequeños, personas mayores y con problemas respiratorios, pasé el mínimo tiempo posible en la calle.",2173,2176,5463972,"2019-12-11T15:00:00+00:00"
"S7RO7m4Bl1lLyrCzP-An","http://www.rtve.es/v/5461083/?t=00h44m43s","La prensa británica no ahorra elogios y destaca la frescura de un veterano grupo que se niega a envejecer con amargura.",2683,2687,5461083,"2019-12-06T15:00:00+00:00"
"A3P_xm4B0RDDG74Kh_j6","http://www.rtve.es/v/5457132/?t=00h24m37s","""Por ser VIH envejecemos 10 años más... dentro de 5 años no sabemos si estaremos como los abuelos con bastón"".",1477,1481,5457132,"2019-12-01T15:00:00+00:00"
"PXP_xm4B0RDDG74KmPrv","http://www.rtve.es/v/5456569/?t=00h44m03s","-Si puedo dar un ejemplo a alguien de algo es de saber envejecer con dignidad.",2643,2647,5456569,"2019-11-29T21:00:00+00:00"
"9m3ftW4B5vX9GyaK1AC5","http://www.rtve.es/v/5455419/?t=00h22m49s","12 años analizando a 95 millones de personas mayores de 65 anos han servido para demostrar que cuando las partículas contaminantes con diámetro inferior a 2,5 micrómetros suben, provocan al dia siguiente un claro aumento de ingresos hospitalarios.",1369,1373,5455419,"2019-11-28T15:00:00+00:00"
"NW3ftW4B5vX9GyaK1QHH","http://www.rtve.es/v/5455419/?t=00h31m15s","A esta hora se investiga si era un conductor ""kamikaze"" En Bilbao una escultura hiperrealista invita a reflexionar sobre la soledad de las personas mayores.",1875,1879,5455419,"2019-11-28T15:00:00+00:00"
"d2zftW4B5vX9GyaKxP14","http://www.rtve.es/v/5454754/?t=00h17m12s","El envejecimiento de la población y el aumento de la esperanza devida según este organismo, hacen necesarias reformas que garanticen su viabilidad.",1032,1036,5454754,"2019-11-27T21:00:00+00:00"
"FGzftW4B5vX9GyaKsfo6","http://www.rtve.es/v/5454580/?t=00h13m10s","El organismo internacional analiza las debilidades del sistema, y pone el foco en el rápido envejecimiento de la población y el aumento de la esperanza de vida.",790,793,5454580,"2019-11-27T15:00:00+00:00"
"gGzftW4B5vX9GyaKKt8y","http://www.rtve.es/v/5452916/?t=00h45m43s","Entre los 6 premiados, la científica Pura Muñoz-Cánoves, experta en el envejecimiento muscular o el físico, José Antonio Sobrino, líder en el terreno de la protección ambiental.",2743,2747,5452916,"2019-11-25T15:00:00+00:00"
"tWzetW4B5vX9GyaKn84l","http://www.rtve.es/v/5450359/?t=00h20m56s","-Yel más longevo.",1256,1259,5450359,"2019-11-21T15:00:00+00:00"
"XWzetW4B5vX9GyaKg8hc","http://www.rtve.es/v/5434690/?t=00h31m04s","Según datos de la DGT nuestro parque móvil es uno de los más envejecidos de la Unión Europea.",1864,1867,5434690,"2019-11-05T15:00:00+00:00"
"QWzetW4B5vX9GyaKasL-","http://www.rtve.es/v/5430890/?t=00h55m01s","Ni él, ni el mas optimista de sus admiradores podía pensar que iba a completar una carrera tan brillante y tan longeva.",3301,3306,5430890,"2019-11-01T21:00:00+00:00"
"VW3gtW4B5vX9GyaKRh3n","http://www.rtve.es/v/5429106/?t=00h56m47s","""Demostrar a todas las personas mayores de 50 años que mientras hay retos, vida y pasión, hay vida"".",3407,3411,5429106,"2019-10-31T21:00:00+00:00"
"FG3gtW4B5vX9GyaKBw33","http://www.rtve.es/v/5425031/?t=00h37m13s","A lo largo de la mañana, hemos visto como han pasado muchas personas mayores, muchos de ellos tenían cita con su médico de cabecera.",2233,2235,5425031,"2019-10-28T15:00:00+00:00"
"HW3gtW4B5vX9GyaKCA0S","http://www.rtve.es/v/5425031/?t=00h38m13s","El año pasado se vacunaron el 54 % de las personas mayores de 65años.",2293,2298,5425031,"2019-10-28T15:00:00+00:00"
"ImzetW4B5vX9GyaKYcDk","http://www.rtve.es/v/5424134/?t=00h33m07s","El desafío comenzó hace dos años para llevar talento a los pueblos, y luchar contra su incesante envejecimiento.",1987,1991,5424134,"2019-10-27T15:00:00+00:00"
"dG3ftW4B5vX9GyaK3gO5","http://www.rtve.es/v/5423321/?t=00h35m06s","Según el Instituto Nacional de Estadística, más de un millón de personas mayores de 65 años viven solas y sufren la soledad.",2106,2109,5423321,"2019-10-25T21:00:00+00:00"
"e2zftW4B5vX9GyaKTeWe","http://www.rtve.es/v/5423116/?t=00h02m05s","Las asociaciones piden más ayudas para el acompañamiento de las personas mayores.",125,128,5423116,"2019-10-25T15:00:00+00:00"
"NG3gtW4B5vX9GyaKTx86","http://www.rtve.es/v/5420590/?t=00h08m04s","También han desaparecido 2 personas, mayores de 70 años, conducían un vehículo.",484,487,5420590,"2019-10-23T15:00:00+00:00"
"Nm3ftW4B5vX9GyaK8ghP","http://www.rtve.es/v/5419216/?t=00h35m44s","Los chilenos, nos comentan, no tienen miedo a morir, sino a envejecer o enfermar.",2144,2148,5419216,"2019-10-22T21:00:00+00:00"
"ng08-W0BCKkHyZ2vYILh","http://www.rtve.es/v/5415820/?t=00h41m58s","Asturias y toda España, que viven el despoblamiento y el envejecimiento de zonas rurales, ciertamente deben encontrar en vuestra actitud y en vuestro caracter emprendedor, caminos para solventar un problema tan grave cuyas consecuencias nos afectan a todos en España.",2518,2521,5415820,"2019-10-19T15:00:00+00:00"
"6w5A-W0BCKkHyZ2vS1_d","http://www.rtve.es/v/5413370/?t=00h36m52s","Estos telómeros, lo que hacen, es proteger a las células del daño y los telómeros se acortan conforme envejecemos.",2212,2214,5413370,"2019-10-17T15:00:00+00:00"
"7A5A-W0BCKkHyZ2vS1_h","http://www.rtve.es/v/5413370/?t=00h36m59s","Nosotros lo que hacemos es generar ratones que ya tienen telómeros más largos cuando nacen y, por tanto, hace que tengan una mayor longevidad.",2219,2221,5413370,"2019-10-17T15:00:00+00:00"
"9Q9H-W0BCKkHyZ2vPNqt","http://www.rtve.es/v/5409076/?t=00h34m38s","El talgo pendular ganó la batalla de la alta velocidad y aquel prototipo comenzó a envejecer en una via muerta de Castejón, Navarra.",2078,2081,5409076,"2019-10-13T21:00:00+00:00"
"3w9H-W0BCKkHyZ2vHtHS","http://www.rtve.es/v/5405639/?t=00h27m21s","Son útiles también para las personas mayores.",1641,1644,5405639,"2019-10-08T21:00:00+00:00"
"Tw4_-W0BCKkHyZ2vRSH3","http://www.rtve.es/v/5403813/?t=00h18m33s","Jeannete lleva 12 años cuidando a personas mayores.",1113,1116,5403813,"2019-10-07T21:00:00+00:00"
"kw4--W0BCKkHyZ2v5Q-8","http://www.rtve.es/v/5403022/?t=00h40m55s","Son ocho mundiales, de momento, pero viendo no sólo la edad, 26 años, sino el ansia por ganarlo todo, y la longevidad cada vez mayor en el motociclismo, no es descabellado apostar por que Márquez supere los nueve mundiales de Rossi, sino también quién sabe, los 12+1 del gran Ángel Nieto.",2455,2460,5403022,"2019-10-06T21:00:00+00:00"
"sg5A-W0BCKkHyZ2vJVdp","http://www.rtve.es/v/5402930/?t=00h42m55s","""Quiero ser piloto profesional como Dani Pedrosa "" Su sonrisa y su ilusión no envejecen y aún tiene muchísimos años por delante para llegar a los 12+1 de Ángel Nieto y a los 15 de Agostini.",2575,2578,5402930,"2019-10-06T15:00:00+00:00"
"kQ08-W0BCKkHyZ2vP32C","http://www.rtve.es/v/5402614/?t=00h25m28s","Es una plantilla envejecida.",1528,1530,5402614,"2019-10-05T15:00:00+00:00"
"bA9E-W0BCKkHyZ2vQztJ","http://www.rtve.es/v/5399703/?t=00h40m31s","A ellas están dedicados algunos de los actos organizados hoy, en el día internacional de las personas mayores.",2431,2437,5399703,"2019-10-01T15:00:00+00:00"
"cw9E-W0BCKkHyZ2vQztf","http://www.rtve.es/v/5399703/?t=00h41m23s","Son historias de vida, historias de ellas que son más longevas, pero también de ellos.",2483,2486,5399703,"2019-10-01T15:00:00+00:00"
"eA9G-W0BCKkHyZ2vBp2D","http://www.rtve.es/v/5393325/?t=00h33m36s","Friends cumple 25 años y envejece bien.",2016,2020,5393325,"2019-09-22T21:00:00+00:00"
"dA4--W0BCKkHyZ2vvQMd","http://www.rtve.es/v/5388059/?t=00h30m15s","Es el primer ministro israelí más longevo en el cargo.",1815,1818,5388059,"2019-09-15T21:00:00+00:00"
"lQ9D-W0BCKkHyZ2vWQoh","http://www.rtve.es/v/5383583/?t=00h27m39s","""Quiero un abuelo"" es el nombre de una web que pone en contacto familias que tienen niños con personas mayores.",1659,1662,5383583,"2019-09-08T15:00:00+00:00"
"pg9D-W0BCKkHyZ2vWQpU","http://www.rtve.es/v/5383583/?t=00h29m08s","Varios estudios internacionales avalan que las personas mayores que están acompañadas en contacto con hijos sufren menos depresiones pero sobre todo, y lo mas importante, viven más, es decir, la esperanza de vida es mayor.",1748,1752,5383583,"2019-09-08T15:00:00+00:00"
"Dg4--W0BCKkHyZ2v9xSS","http://www.rtve.es/v/5383317/?t=00h11m53s","Dorian es ya uno de los huracanes más longevos.",713,716,5383317,"2019-09-07T21:00:00+00:00"
"Dw5B-W0BCKkHyZ2vOZIi","http://www.rtve.es/v/5381498/?t=00h18m31s","El que fue uno de los gobernantes más longevos del mundo, Robert Mugabe, ha muerto a los 95 años.",1111,1114,5381498,"2019-09-06T21:00:00+00:00"
"Wg9F-W0BCKkHyZ2v-Zpa","http://www.rtve.es/v/5380806/?t=00h18m06s","Hasta 2017 fue el presidente más longevo del mundo.",1086,1090,5380806,"2019-09-06T15:00:00+00:00"
"gg07-W0BCKkHyZ2vPUCU","http://www.rtve.es/v/5368852/?t=00h10m50s","Contentísimos de volver a casa los animales, las personas mayores y demás"" La situación ha mejorado.",650,652,5368852,"2019-08-20T15:00:00+00:00"
"4A5C-W0BCKkHyZ2vAMHq","http://www.rtve.es/v/5367339/?t=00h28m17s","Esta infección provoca fiebre y vómitos y tiene más riesgo para niños y personas mayores.",1697,1701,5367339,"2019-08-16T15:00:00+00:00"
"rQ5A-W0BCKkHyZ2vvHyu","http://www.rtve.es/v/5365425/?t=00h52m07s","El campo de acción de Grandes Amigos es el de las personas mayores, que reciben visitas semanales de voluntarios, que les hacen compañía y con los que traban amistad.",3127,3130,5365425,"2019-08-12T15:00:00+00:00"
"rw5A-W0BCKkHyZ2vvHy0","http://www.rtve.es/v/5365425/?t=00h52m23s","-Cuando acompañamos a personas mayores, nosotros les damos, pero recibimos lo que les damos, multiplicado por lo que quieras.",3143,3147,5365425,"2019-08-12T15:00:00+00:00"
"kA5B-W0BCKkHyZ2vw7ua","http://www.rtve.es/v/5362006/?t=00h29m04s","El estudio se ha llevado a cabo con datos de más de 2.500 personas mayores de 60 años y demuestra que los pacientes que han recibido un riñón de un donante de más de 80 años ganan en esperanza y calidad de vida.",1744,1746,5362006,"2019-08-06T21:00:00+00:00"
"1A9F-W0BCKkHyZ2vo4e5","http://www.rtve.es/v/5357404/?t=00h35m50s","Lo que hay que darse cuenta es que las personas mayores pueden seguir aprendiendo.",2150,2152,5357404,"2019-07-28T21:00:00+00:00"
"1w4--W0BCKkHyZ2vxwbs","http://www.rtve.es/v/5356203/?t=00h35m32s","Los resultados en ratones abren la puerta a nuevas terapias para combatir enfermedades como la progeria, que provoca el envejecimiento acelerado del organismo.",2132,2136,5356203,"2019-07-25T21:00:00+00:00"
"2A4--W0BCKkHyZ2vxwbv","http://www.rtve.es/v/5356203/?t=00h35m43s","Las alteraciones de la microbiótica intestinal contribuyen al envejecimiento acelerado.",2143,2146,5356203,"2019-07-25T21:00:00+00:00"
"2Q4--W0BCKkHyZ2vxwbx","http://www.rtve.es/v/5356203/?t=00h35m48s","Los investigadores han demostrado que los ratones y también los pacientes que padecen Progeria, esa rara enfermedad que aparece en la infancia, acelera el envejecimiento y causa la muerte prematura, tienen niveles alterados, a la baja, de bacterias presentes en la flora intestinal.",2148,2152,5356203,"2019-07-25T21:00:00+00:00"
"2w4--W0BCKkHyZ2vxwb3","http://www.rtve.es/v/5356203/?t=00h36m08s","-Los seres humanos con una longevidad excepcional, como son los centenarios, también tienen una señal o un perfil particular en estas bacterias del intestino que podrían estar promoviendo una mejor salud.",2168,2172,5356203,"2019-07-25T21:00:00+00:00"
"3A4--W0BCKkHyZ2vxwb6","http://www.rtve.es/v/5356203/?t=00h36m23s","Una flora intestinal desequilibrada acorta la vida porque acelera el envejecimiento.",2183,2187,5356203,"2019-07-25T21:00:00+00:00"
"4A4--W0BCKkHyZ2vyAYG","http://www.rtve.es/v/5356203/?t=00h36m46s","Regular la microbiótica intestinal mediante trasplantes o probióticos es una línea de investigación que podría emplearse como futura terapia en las enfermedades relacionadas con el envejecimiento acelerado.",2206,2209,5356203,"2019-07-25T21:00:00+00:00"
"KQ9E-W0BCKkHyZ2vmVCm","http://www.rtve.es/v/5354343/?t=00h46m02s","Longeva también parece la relación del Barça con un Rakitic que pasa de los rumores acerca de su salida.",2762,2766,5354343,"2019-07-22T21:00:00+00:00"
"Hg07-W0BCKkHyZ2vxly7","http://www.rtve.es/v/5348654/?t=00h22m41s","Está genial nos hacen descuentos"" Según la patronal de fabricantes ANFAC, en 2018 se dejaron de vender 45.000 vehículos debido también, al envejecimiento de la población, a los nuevos patrones de consumo de los jóvenes al cambio de modelo del sector y también a la intestabilidad política Elecciones no son lo mejor para vender coches.",1361,1367,5348654,"2019-07-19T15:00:00+00:00"
"mQ09-W0BCKkHyZ2v3NHl","http://www.rtve.es/v/5346838/?t=00h16m53s","En Estados Unidos es noticia también la aplicación FaceApp, que permite transformar y envejecer el rostro de quien la utiliza.",1013,1016,5346838,"2019-07-18T15:00:00+00:00"
"Bw9F-W0BCKkHyZ2vTnad","http://www.rtve.es/v/5341558/?t=00h17m22s","Las personas mayores de 65 años ya son el 19% de la población y preocupa que esta es la franja de edad en la que hay más fallecidos por accidentes de tráfico.",1042,1047,5341558,"2019-07-15T21:00:00+00:00"
"pw5A-W0BCKkHyZ2vr3pO","http://www.rtve.es/v/5335485/?t=00h46m42s","No es una película que se tome muy en serio así mismo, y eso a lo mejor es lo que nunca envejece.",2802,2806,5335485,"2019-07-12T15:00:00+00:00"
"yA5A-W0BCKkHyZ2vjXKE","http://www.rtve.es/v/5333336/?t=00h22m32s","Esta mujer, con su madre tetrapléjica, teme por las personas mayores enfermas.",1352,1354,5333336,"2019-07-11T15:00:00+00:00"
"yg08-W0BCKkHyZ2vv5cC","http://www.rtve.es/v/5329681/?t=00h01m59s","Y así, en brazos de la Guardia Civil, Hay muchos vecinos que han perdido sus negocios, fueron evacuados algunos vecinos, e incluso sus casas. sobre todo niños y personas mayores, en varios pueblos de Ourense.",119,120,5329681,"2019-07-09T21:00:00+00:00"
"-g5B-W0BCKkHyZ2vVpos","http://www.rtve.es/v/5329140/?t=00h30m02s","Investigadores españoles ha encontrado la clave de la longevidadde los animales.",1802,1805,5329140,"2019-07-09T15:00:00+00:00"
"BA5B-W0BCKkHyZ2vVptN","http://www.rtve.es/v/5329140/?t=00h30m49s","Cuando los trelómeros se acortan las células dejan de dividirse, envejecen y mueren.",1849,1852,5329140,"2019-07-09T15:00:00+00:00"
